[
  {"version":"1.1","event_id":"alpha-foundation","project_id":"alpha","occurred_at":"2026-08-01T10:00:00Z","event_class":"RETAINED_VALUE","event_type":"CONTROL_ADOPTION","value_class":"FOUNDATION","points_delta":2,"capability_lineage_id":"alpha-cap","value_scope_ref":"SYNTHETIC::ALPHA::FOUNDATION","summary":"synthetic retained foundation","mapping_rationale":"synthetic durable capability anchor","sources":["github:example/alpha#1"],"supersedes_event_id":null,"restores_event_id":null},
  {"version":"1.1","event_id":"alpha-repair","project_id":"alpha","occurred_at":"2026-08-02T10:00:00Z","event_class":"PROCESS","event_type":"REPAIR","value_class":null,"points_delta":0,"capability_lineage_id":"alpha-cap","value_scope_ref":null,"summary":"synthetic repair activity","mapping_rationale":"process is visible but creates no retained value","sources":["github:example/alpha#2"],"supersedes_event_id":null,"restores_event_id":null},
  {"version":"1.1","event_id":"beta-integrated","project_id":"beta","occurred_at":"2026-08-03T10:00:00Z","event_class":"RETAINED_VALUE","event_type":"INTEGRATED","value_class":"INTEGRATED_CAPABILITY","points_delta":3,"capability_lineage_id":"beta-cap","value_scope_ref":"SYNTHETIC::BETA::INTEGRATED","summary":"synthetic integrated capability","mapping_rationale":"synthetic integration retains capability value","sources":["github:example/beta#3"],"supersedes_event_id":null,"restores_event_id":null}
]
